date,year_month,rating,text,text_len,vader_compound,vader_pos,vader_neg,vader_neu,sentiment
2004-08-24,2004-08,5.0,"Brilliant value, excellent staff. The beautiful setting is to be expected for this part of the world, but what makes this hotel exceptional is the ""Can-do"" attitude and friendly helpfulness displayed by every staff member.  The rooms are clean, comfortable and well appointed, the quiet location engenders a restful ambience, yet it is quite close to the London-Brighton motorway.  Easily the best value for many miles around, as a frequent business traveller in need of a little serenity, I have made this hotel a regular stopping point.
",539,0.9903,0.357,0.016,0.627,positive
2004-09-21,2004-09,4.0,"Total bargain! A stay at the Hickstead & a day at Brighton races. We went to the hotel as part of a package day with Brighton Racecourse, which is 15 minutes away.

It was the most incredible value, £55 per person for overnight accomodation, breakfast and a day at the races.

I wasn't expecting the hotel to be very good for the price we paid, but it was excellent! The staff were friendly and helpful and the room a good size. The decor was a little bit dated but clean, but I understand from the staff that a refurbishment is about to start.

There was a good choice for breakfast and the hotel was in a lovely quiet spot.

I have told so many people about it, our stay was such good value!

Shame that our luck at the races wasn't as good as with the hotel!!
",763,0.9912,0.253,0.039,0.708,positive
2005-03-23,2005-03,2.0,"Meet Basil here. I strongly recommend the Hickstead Hotel to fans of Fawlty Towers who would like to see what it is like to stay in a tumble down building managed by people who have not a clue about how far they are from the standards freely available from competitors.  

Photographs on various web sites show a nice rural aspect with a wood fence, and describes the hotel as a great base to explore the local countryside.  The hotel is in fact right by the busy A23, and looks out on industrial-looking buildings.

Web sites also describe the hotel as having an indoor pool and a mini gym.  It's hard for two people to swim in the pool at the same time, and the mini gym consists of three or four machines in a room the size of a couple of lavatories.

There is battered paintwork and threadbare carpet everywhere.  To be fair, there is a refurbishment programme under way; but the curtains in the newly done-up rooms don't match the carpets.

The best feature is the food.  It can take a while to arrive (half an hour to be brought any coffee at breakfast), but it is good when it appears.
",1093,0.9652,0.113,0.006,0.881,positive
2005-03-31,2005-03,5.0,"fantastic. A beautiful hotel for a wonderful weekend away. 
The staff and the building have a very homley feeling, 
comfortable and friendly, excellent cuisine and service, allround a wonderful hotel experience.
I am looking forward to going back soon.
",253,0.9801,0.467,0.0,0.533,positive
2005-08-15,2005-08,2.0,"very shabby. clean rooms, but hotel overall ""shabby"", and £11.00 for 4 cups of tea!!",84,0.3763,0.155,0.0,0.845,positive
2007-10-26,2007-10,5.0,"Really nice hotel with friendly staff. Stayed for two nights when visiting Brighton in Oct 07.  My daughters also stayed in a twin room for one night.

Given the poor reviews on trip advisor, I was a bit worried about what to expect.  The reviews are totally out of date and the hotel highly recommended.  Really nice friendly reception staff, the room rate was competitive for that area but offers better value.  

The room was very clean and large for a double, nice bathroom with everything you could want.  If you are a very light sleeper, ask for a room upstairs, but otherwise it was very quiet during the night.

Breakfast was the best I’ve had in a long while, huge selection and very helpful staff.  If you like a good cooked breakfast, then this is the place for you.  I do about 40 - 60 hotel nights per year around the world, this was one of the best breakfasts I’ve had for many years.

There is the added advantage of the swimming pool and sauna.  The gym is a mini one, so don’t expect to burn off your breakfast.

Would stay again and recommend for families and business trips as both are catered for very well",1126,0.9955,0.248,0.015,0.738,positive
2007-11-12,2007-11,4.0,"Quiet. Very Piecefull hotel, cleen rooms, comfortable.

I slept in till 10:50, and made the 11:00 checkout, even with a room at the busy end of the corridorr, overlooking the car park, I was not woken by any noise - you can't say that about many hotels.

I did have the burger on room service, and I eat a lot of burgers, this one was really really bad",352,-0.1953,0.045,0.055,0.9,negative
2008-03-29,2008-03,1.0,"We stayed............ for 30 miniutes!. I'd booked the Hickstead for a short Easter weekend break, hoping for a nice dinner on Sunday night, comfortable stay, use of the pool etc on Monday morning, and a lunch before we left for home. No-one greeted us at reception - too busy serving drinks in the bar. Eventually, we were booked in, by a member of staff who couldn't have been more cheery - whilst she was telling us about the amenities - restaurant - closed, and the pool - closed....""oh that's been closed for a while - it's a general maintenance problem!"" Then why, we asked, are we here? We'd ordered some bar food [burgers, etc] as that was all there was on offer. We thought about the £80 we'd be spending, booked a cab, and caught a late train home. As we waited the promised 10mins for our cab, Cheery Receptionist asked if we wanted our food! 
I checked the hotel website a few days later and saw they'd sneakily removed the reference to the 'pool'. Still nothing saying the restaurant was ""always closed on Sunday evenings!"", as the cheery one assured us.
Back home, the welcome was sincere, food delicious, there was no smell of damp, and we went to our local lido the following morning",1199,0.9858,0.154,0.02,0.826,positive
2008-11-05,2008-11,4.0,"Quality evening meals & friendly receptionists. We would like to give positive feedback to the hotel after enjoying a weekend break there, primarily to visit Brighton.
We stayed in one of the two executive superior rooms, which came complete with new decor, bottles of still & sparkling spring water, hygienically-sealed bathrobes and a plate of sliced strawberries, marshmallows & dusted maltesers. Only slight grumble was the view. The bed was very comfortable and we slept soundly on both nights. 
We can honestly say that the staff were all professional: the receptionists and the dining room manager were good; the breakfast service did lack a little consistency around the room. 
The evening meals, prepared at the weekend by the sous-chef, were of a very high quality indeed. The slightly plain descriptions on the menu and the very reasonable prices gave no hint of the delights that awaited you. Everybody seemed pleased with their meals - a very rare experience in any restaurant. The cooked breakfast was generally good and the continental one adequate.
Our stay coincided with The London-Brighton Veteran Car Rally and I would recommend anyone participating in or spectating at this event to give this hotel a try. Don't be put off that it is not in Brighton itself as it is well-located and has free parking. And you will probably get a much better night's sleep than many of my fellow reviewers have done when staying in Brighton!
A good value 3* hotel with friendly staff and great evening meals",1510,0.995,0.21,0.019,0.771,positive
2009-02-15,2009-02,5.0,3 Star hotel 5 STAR SERVICE. My wife and I had a brilliant stay. Patricia Cole on reception was outstanding. Room was spotless. Valentine night restaurant was full but the service was still great. Cannot believe this is only a 3 star hotel. I have stayed at much more expensive hotels that were not as good. I will be returning and will recommend this hotel to my friends. Do not confuse this hotel with the Travellodge up the road,431,0.9365,0.197,0.033,0.77,positive
2009-03-11,2009-03,4.0,"very relaxing weekend. Stayed friday and saturday night nice room , very pleasant and friendly staff . We ate in the Bistro restaurant both nights and really enjoyed the food. We were glad we chose to stay outside Brighton as it was a lovely quiet location. Would definately return",281,0.9743,0.361,0.0,0.639,positive
2009-05-12,2009-05,4.0,"Nice Place to Stay. Conveniently located to explore South Downs and Brighton.

We stayed at The Hickstead on the Tesco Clubcard Deals scheme and were not disappointed. Firstly the Classic Lodges web site displays the price of a leisure break clearly and this makes it easy to order your vouchers ( unlike some other hotel chains where the price you pay on the clubcard deals scheme is far more than the price on their web sites).

The rooms at the hotel are fairly characterless but this did not matter to us because:
1. The rooms are a decent size
2. The bed was extremely comfortable
3. The en-suite had a decent bath and nice toiletries
4. Liked the standard items such as tea/coffee machine, hairdryer and trouser press
5. Especially liked free WiFi & Sky Sports on the TV ( although no mini bar )

We were initially worried about the noise from a wedding party but actually never heard a thing all night and always had a feeling that the guests were courteous to each other.

We ate at the hotel one evening and were pleasantly surprised at the quality ( Sea Bass was well cooked and imaginatively presented ) and wished we had eaten there the second night ( don't recommend the cheese and biscuits option though as the cheese wasn't particularly inspiring). Breakfasts were very good with a buffet style range of cereals and fruits and then full English - Delicious.

As for the local area, we enjoyed Borde Hill Gardens ( azaleas and rhododendrons were a delight in May ) and the walks at The Jack and Jill Windmills and Devils Dyke with sweeping views of the Downs.

Overall The Hickstead was a nice place to stay and I would definitely stay there again",1661,0.9954,0.202,0.052,0.746,positive
2009-08-22,2009-08,3.0,"Nice hotel but lacks character. Stayed Thurs/Fri night with my partner using Tesco club card. We felt slightly disappointed on arrival as the Hotel didn't match up to the way it was portrayed on the website. We were expecting the rooms to be within the house itself and not in a purpose built modern annex and expected more to have been made of the ""7 acres"" on which it is situated. However we thoroughly enjoyed our stay. The rooms were large, clean and well equiped although characterless with little view. The staff were very friendly and helpful. The food in the Bistro was excellent! and the breakfast was very good too. The hotel is well situated for many local attractions within easy reach",698,0.9906,0.273,0.024,0.703,positive
2009-09-30,2009-09,3.0,"Better than expected. It's worth noting that this hotel is not in Bolney, and if you take the Bolney exit off the A23 you will get lost! You need to go two junctions further south on the A23 then take the Burgess Hill exit. Once you find it the place is OK, very quiet countryside location, friendly attentive staff and reasonable food. The room was clean, and excellent water pressure in the shower",399,0.8805,0.172,0.053,0.775,positive
2010-03-15,2010-03,5.0,"Lovely Food and Service. I have stayed at this hotel in the past on business.  I stayed in March 2010 for one night.  I arrived after a 3.5 hour drive and check in was smooth and hassle free.  The room I stayed in was of a good size and included a large dressing table a small table and two chairs.  When I stayed here previously the room I was in had a small sofa rather than a table and chairs.  I ordered room service and the food arrive quickly and was cooked to perfection.  I have to say that the food at the Hickstead is lovely.  The bed was comfortable and I had a good nights sleep.

I had breakfast delivered to my room the following morning and the one downside was that this was delivered a little later than I had requested.

I have stayed in various hotels on business and find that the Hickstead is one of the better hotel I stay at.  I will most certainly be staying here again",893,0.9804,0.151,0.01,0.839,positive
2010-07-26,2010-07,4.0,"Weekend Stay Outside Brighton. Stayed on The Spring and Summer Saver which was excellent value for money.  Staff were extremely attentive and couldn't do enough for you, the food was excellent value for money and very good quality, with an excellent choice.  Rooms were very comfortable, although the rooms at the back did not have the good views at the front of the hotel.  Would have liked air con as it was a very warm weekend but apart from that an extremely enjoyable weekend will definitely going back",507,0.966,0.252,0.016,0.732,positive
2010-09-29,2010-09,5.0,"Fantastic Wedding Venue with Excellent Staff. Bit late writing this review!  We got married at the Hickstead in February this year and cannot fault the staff or venue.  Giles was our main contact from the initial booking through to the event itself and was fabulous.  The staff were unflappable and dealt with leaking babies nappies and vomiting children without fuss and so unobtrusively that those who hadn't seen the ""accident"" were totally unaware it had occurred.  A small party arrived the night before and we had a fantastic meal in the restaurant.  Rooms were a good size, clean and very pleasant.  Wedding Breakfast was excellent.  Most guests stayed overnight and we all enjoyed an excellent breakfast.  Highly recommend the venue for a place to stay or a wedding.  We will definitely return",801,0.9925,0.287,0.013,0.701,positive
2010-10-28,2010-10,2.0,"Quite simply too expensive for what it is!. Overall I would give this two stars and only just that! I will explain:

Character : 0/5. It looks and feels like a Nuffield hospital, but a but more shabby. 

Rooms : 2/5. Decent size, but no coffee table to sit at, just a single chair in the corner and a plastic shower curtain aaaaarrrgh !!!!!!  There is absolutely no excuse fir curtains in any bathrooms, especially ones at £130 a night!

View and grounds : 1/5 ignore the 7 acres, as they only use about 1 which is made up of carpark and a few bushes. The view from my (and many other) windows was of an overflow carpark, a few trees and an I austral unit! See the photo for proof! 

Food and restaurant : 2/5. Even though others have rated this aspect, I have to disagree. Whilst the service and staff were very good, the quality was poor. The atmosphere in the restaurant in the evening was very ""bright lights and 80's "" Come on Hickstead you can improve that with a bit if thought and effort !!

Location: 4/5. To be fair this is all that is has going for it at present, along with nice supportive staff. Great access to Brighton (15 mins) and easy to find. 

Overall, we were very disappointed with our trip and felt that if it had not been with the Tesco vouchers we would have been absolutely gutted. With them was bad enough!  The hickstead need to be realistic, it is a very small hotel with no character and a dated interior. Not what I want to spend £130 a night on!",1477,0.8365,0.11,0.089,0.802,positive
2011-02-09,2011-02,4.0,"Friendly staff and all round good hotel.. We stayed at The Hickstead for a weekend getaway and to explore surrounding areas including Brighton.  

Firstly the booking process (using clubcard vouchers) was quick and easy.  When we got there the reception staff were welcoming and friendly.  We were pleased with the hotel room and general standard of the hotel.  It was very clean and comfortable and the bedroom and bathroom were also decorated to a high standard. 

We had breakfast twice and dinner in the hotel once.  The food was to a very good standard and the service from the staff was again excellent.

I would recommend this hotel to others and would be happy to stay there again!",689,0.989,0.264,0.0,0.736,positive
2011-03-15,2011-03,4.0,"Good Job. Hotel in handy location just off A23, in Jobs Lane, about 10 miles from Brighton.  Easy to park, and nice hospitality is the winning feature of the hotel.  Had a good deal with the winter warmer offer for dinner, bed and breakfast, plus a bottle of prosecco, and we could pick anything we liked from the a la carte menu for dinner!",341,0.9595,0.262,0.0,0.738,positive
2011-04-29,2011-04,3.0,"Feels like an upmarket Premier Inn. Room was supposed to be a superior but apart from an additional table and two chairs it was nothing more than a room you could expect from the likes of Premier Inn. The hotel employs that many chefs who all have their own takes on the menu that it is possible as happened to us that no two dishes will be the same. When it was queried with the waiter I was told, after he had consulted with the chef, that the chefs vary the dishes because of complaints from regulars that the meals are always the same??? (surely you change the menu not each dish). Having said all that the food was good",624,0.8621,0.118,0.047,0.835,positive
2011-05-28,2011-05,3.0,"Did the job. This place did the job as we needed somewhere to stay near Brighton. We used Tesco vouchers otherwise it would have been £135 per night, which does seem very expensive. The rooms were nothing special, the hotel is not particularly attractive from the outside and the view from our window was of an industrial estate.

However, the bedroom was clean, the bed was comfy, the breakfast was very nice and all the staff we dealt with were incredibly pleasant and helpful, which made up for any gripes I may have had. The customer service at every point really was superb and it's a pity that more hotels in the UK can't follow suit",639,0.8945,0.128,0.054,0.819,positive
2011-06-01,2011-06,4.0,"Fantastic Value. Clean hotel with excellent service. Wasn't sure what to expect but very impressed. The room was big, clean and had everything you'd expect from a good hotel. We wanted somewhere to stay whilst visiting the local vineyard and glad we chose this hotel. A taxi to the vineyard was about £10. We paid £99 for dinner, bottle of wine, bed and breakfast direct with the hotel. Food was ok, waitress was very helpful and friendly",438,0.9856,0.329,0.015,0.657,positive
2011-06-01,2011-06,4.0,"Good food, nice room, good service. We've stayed here before and had up and down experiences. Happily this was an up visit!

The staff were welcoming and the dinner and breakfast service was good.

It's had at least one previous owner, if not 3 or 4. The present management are doing better on strength of our one night stay, although an excellent rating is not quite justified - some of the decor in corridors and the room was looking slightly tired, but not seriously so",472,0.9174,0.211,0.037,0.753,positive
2011-06-05,2011-06,4.0,"Very Very Nice. We stayed 4 nights at this hotel.   We got a really good deal -   £400  for the room,  breakfast,
dinner every night, and a bottle of wine every night.    Breakfast was excellent -  they had
everything.  The dinner menu was also very good,  with specials every night, although
these were a bit repetitive.  The portions of food were too big --  unusual for UK. The room and bathroom were nice and clean.  The hotel is set in a lovely rural area,  but not too far 
from anything.  Not sure how noisy it could be when they have weddings,  conferences etc.
The staff were really friendly,  and extremely helpful.   We would definitely stay here again.
We paid the bill when we checked out, not before",713,0.9724,0.198,0.027,0.775,positive
2011-06-28,2011-06,5.0,"Could not be better. Thank you so much to all the wonderful staff here, we stayed a few nights when our new granddaughter was born at Haywards Heath hospital. 
The kindness and service was exceptional (I own my own Travel Agency so I have visited many hotels from hostels to 7* over the years).
It's a good quality 3* in terms of rooms/decor and amenities, but in terms of customer service it's 5* and above.
We felt welcome at all times, the cleaners were among the best that I have ever experienced.
Will we return - yes 100% we will next time we visit our family.
Thank you so much",584,0.9668,0.18,0.026,0.794,positive
2011-06-30,2011-06,5.0,"A chain hotel that thinks it is a family concern. This hotel benefits from its proximity to two places. Hickstead, where many equestrian events take place and Burgess Hill, where commercial pilots train. The relationship between London Gatwick pilot training and the hotel is very good and much of their business is derived from training pilots. I understand their courses last for 40 days; that sounds like good business to me but obviously the hotel had to earn their reputation.
The hotel stands on grounds in the middle of fields without any particular attraction to them a few hundred yards from a main road where traffic is fairly noisy during the day, though not disturbing at night. It is a small hotel, with a restaurant with very good chefs and you were greeted on entry with politeness and helpfulness.
There was no beer on tap when I arrived, and there was no Guinness so I had to make do with a gin and tonic my partner had some bottled beer. For a large gin and tonic, a bottle of beer and two packets of peanuts we paid £12.60 so the prices are pretty standard for mid-level hotels in my experience. I was glad they kept the background music down in the lounge, it is after all called background music not foreground music.
Our room was large enough the shower was delightful and the mattress very comfortable.
We were on special offer £99. double DBB and we did not have to stick to a 'special' menu so we could take our choice from anything on the main bistro menu. That was a big plus. We also had a bottle of very decent wine.
In short, I find this hotel unpretentious, friendly, and does the job. Deborah, our waitress for the breakfast, had been working for the place for seven years and had a deep love and affection for it. Her mother was in charge of room service so it is a family thing. Yes, I would stay there again.
PS they are already booked out for Hickstead next year",1898,0.9955,0.163,0.027,0.81,positive
2011-07-21,2011-07,5.0,"Staff, Hotel, Food Great. Stayed for one night as went to the local wine tasting event.  Booking was easy and very friendly. Upon arrival staff welcoming, ordered a taxi for us to local vineyard, room spacious, clean.  Staff from the receptionist, bar and restaurant staff were fantastic and no fault there.
The only negative would be the decor of the place, a little dated (apart from the bar and restaurant) but this no way spoilt our stay. Food was excellent and really good portions, the breakfast choice was great either hot or cold so choices for all.  Where hotel situated was great and although we only stayed for one night it really felt like we went away. Would come again and recommend.  I would like to add well done to the hotel as whole with their service and staff.  MANY THANKS",793,0.9933,0.291,0.031,0.678,positive
2011-07-29,2011-07,4.0,Nice comfortable and homely.. Nice quiet place. Good for pilots visiting CAE. Recommended for long stays,104,0.9118,0.553,0.0,0.447,positive
2011-08-09,2011-08,4.0,"Nice hotel, very pleasant staff. Stayed here one night for my husband’s birthday on the dinner, bed and breakfast package. Check in was quick and easy. Room was clean. Dinner portions were large but the food was plain and breakfast was very simple. Was slightly disappointed as when booking I was assured that dinner staff would make a bit of a fuss over my husband for his birthday, but no one did as much as say happy birthday.
Still hotel staff were friendly, professional and polite. There was a large tourist group the night we stayed but the hotel was still peaceful and quiet. Free wifi was also included. For what we paid it was good value for money, especially considering it was a bank holiday weekend",711,0.9865,0.25,0.041,0.709,positive
2011-08-16,2011-08,5.0,"a real friendly caring hotel. Stayed for a week due to a family illness. This hotel has an excellent staff, rooms were cleaned efficiently, restaurant service first class and welcoming and food was thoroughly enjoyed by us all.. Staff were pleasant and friendly and went out of their way to help us when we needed it. I would definately stay there again and would recommend this hotel just on it's relaxed friendly atmosphere. The staff were a definate plus side to our stay I just wish it had been under better cicumstances. Thankyou from us all",546,0.9901,0.339,0.021,0.639,positive
