date,year_month,rating,text,text_len,vader_compound,vader_pos,vader_neg,vader_neu,sentiment
2015-09-29,2015-09,2.0,"More tea? That would have been nice.. Second tea we've had here, both using. Virgin Vouchers. Really glad we didn't pay. The dining room is like an office canteen, lacking decor or atmosphere. So this time we asked if there was a garden so that we could have tea outside with the dog on a beautiful sunny Sunday afternoon. The garden was actually the car park outside the main entrance with tables on the Tarmac. Apart from the lady in reception the five minutes of service we got was noticeable for the lack of smile or talking. Champagne tea for two is half a bottle which gives you a good couple of glasses but the rest was a left down. One and a half rounds of sandwiches (egg, ham and salmon) a scone, a meragine complete with blonde hair, a sponge neither of us fancied and a soft shortcake biscuit. We were totally ignored once the tea had been dumped, no refills or usual ""how is everything?"" visit. We gave up after an hour of cold tea and walked the ten foot to our car. One advantage of tea on the Tarmac!  There are so many quaint places for afternoon tea around this part of Sussex. This ain't quaint and won't be getting a further visit",1150,0.5199,0.085,0.049,0.866,positive
2015-10-04,2015-10,4.0,"Nice place for a wedding package.. We stayed there for one Friday night after a wedding event. Parking is easy with plenty of it, it is also in a rural location which is nice. The staff were very helpful and Giles the manager was very helpful with all the wedding guests needs. Our room 226 was on the first floor close to the stairs so during the night people were heard on the wooden stairs. The room it's self was comfortable and had nice little touches like fruit and a paper. In all a good place to stay. Right now comes the yes or no bit...
Would we recommend the hotel.... Yes we would.
Would we stay again..... Yes we would....

Tip room 226 is quite noisy  due to the wooden stairs",690,0.9839,0.231,0.027,0.742,positive
2015-10-05,2015-10,4.0,"Quiet hotel away from the bustle of Brighton. Four of us stayed here last night for a one night break. We were looking for accommodation in Brighton but were put off by the expensive prices! We came across this lovely hotel hidden 12 miles away in the countryside. The rooms were a generous size with a double bed and tea & coffee facilities. We had a three course meal which was beautiful, every meal was made fresh and was really tasty. We also had a free glass of wine within the offer. The breakfast was really nice with a large selection of cereals, cooked breakfast, fruit juices, yoghurt, fruit and croissants. We were also given a pot of tea and coffee each as well as a round of toast. Would definitely recommend this hotel if on a break in Brighton but don't want to pay top end prices for one night",809,0.9916,0.226,0.007,0.767,positive
2015-10-05,2015-10,4.0,"Nice peaceful hotel. Stayed here for a family wedding. Plentiful parking, spacious bar and rooms massive compared to other small hotels.
Food ok.
Room was cold during the night.
Breakfast was nice although a few more veggie options would've been nice.
Mushrooms and beans for me!
Had a great stay in all",303,0.9432,0.254,0.0,0.746,positive
2015-10-07,2015-10,5.0,"Amazing Wedding!. My sister and (new!) brother in law got married at this hotel on a Friday. Everything was perfect! Giles was, and is, amazing! He is not afraid to get stuck in and help out, and nothing was too much trouble. 
The hotel is in a perfect location, the food was brilliant and the rooms perfect. Dinner was lovely, leak & potato soup to start, chicken with rosti and veg for main and profiteroles for desert, breakfast was also lovely, both hot and cold options available. After the wedding a few of us sat in the bar and they did not shut the bar until we were finished! Think we had the poor bar maid up until 2am!! 
Thank you Giles and the Hickstead Hotel for a wonderful wedding package!!",705,0.9867,0.25,0.061,0.689,positive
2015-10-16,2015-10,4.0,Afternoon tea . Lovely afternoon tea for my friends birthday. Really welcoming and friendly. Had an extra pot of tea and spare cakes in a doggy bag. We were there for a couple of hours and may have overstayed our welcome though they never said. Cakes were nice and so were the sandwiches. Would recommend this place for an afternoon tea,336,0.9677,0.288,0.0,0.712,positive
2015-10-19,2015-10,4.0,"Friendly welcome. Always made to feel at home. Breakfast is filling and so tasty. Ample and secure parking. Privilege Club benefits include slippers, fresh fruit, newspaper and bottled water. Friendly bar and evening meal add to a pampered feeling",247,0.9565,0.4,0.0,0.6,positive
2015-10-19,2015-10,5.0,"Overnight stay. My partner and i have been visiting this hotel for over 4 years, and this was around our 6th stay.  This was the first hotel we stayed in after we met in 2011, and it's so lovely, and has such special memories, we try to visit at least once or twice a year.  It's a great location for us as we are frequent visitors to Brighton, and The Hickstead is approx a 20 minute drive away, and although not far from the motorway, is in a peaceful rural area.

The rooms are tastefully decorated, and comfortable, the staff are always curteous and polite, and the food in the Oak Tree restaurant inside the hotel is excellent.  Compliments to the chef again.  I chose a tomato soup, double lamb cutlet followed by dark chocolate mousse with shortbread biscuits!  Absolutely delicious as the food always is here, including a quality full English the next morning too.  Thank you again to everyone at The Hickstead - See you soon!",934,0.9857,0.166,0.0,0.834,positive
2015-10-19,2015-10,2.0,"Afternoon tea. We were given a voucher for afternoon tea. After several attempts at booking a convenient date and dealing with a unfriendly receptionist we finally arrived to have our tea. The receptionist was not very attentive an carried on talking to her colleague making us feel unimportant. She then led us to a table in a stark dining room. We were seated very close to two other couples having the same afternoon tea. Although the food itself was plentiful and looked great the whole experience could have been made better. First of all the tables could have been spread out a little so that you could have a romantic time with your other half without the people on the next table listening to your every word. We did ask to be moved but was told we couldn't because we had to sit where it had been laid for tea... a cup and saucer and a plate! I had visions of a nice white table cloth and a pot of tea with water etc. but the table was bare and cold and although we did get a pot of tea it was too strong to drink as I like weak black tea. The music was also awful. There was pop music playing loudly in the restaurant.  The other couples were offered more drinks but we were left until we had finished before we were asked. The waiters and waitresses were professional but only popped in a couple of times, otherwise we felt abandoned. Whilst the chef had done a good job with the cakes and sandwiches it was let down by the organisation in the restaurant. Would we go again? No",1488,0.8122,0.085,0.058,0.857,positive
2015-10-19,2015-10,5.0,"Night away - October 2015. My Partner booked a special treat for us to have a night away at the Hickstead Hotel.  This is about our fifth visit to the hotel and we always feel at home here.
We had booked a Dinner, Bed and Breakfast package inc a large glass of wine package directly with the hotel.  On arrival we were greeted by the receptionist who recognised us from our last visit and although we were early our room was ready.  We spent the afternoon in Brighton before heading back for our dinner booked for 7.30pm.  Giles the General Manager was on hand to show us to our table and again recognised us from the last time.  Our three course meal was excellent and the menus enabled us to pick and choose courses all of excellent quality and very well presented.  As a three star hotel other establishments can learn a great deal from this hotel.  In the morning we plumped for a cooked breakfast which was cooked to order and there were a great selection of cereals, croissants and fruit.  Emily our server was very attentive and an asset to the team.  Thank you Giles and the team for another excellent stay we will be back very soon",1140,0.9898,0.168,0.0,0.832,positive
2015-10-27,2015-10,4.0,"Lovely afternoon tea... Our children had bought us a voucher for an afternoon tea and we chose the Hickstead.
It does look a little bit like a retirement home, but we were warmly welcomed and seated straight away. The staff were very friendly and helpful and we had an excellent tea. Fresh cream cakes and nice sandwiches. My wife had a soft drink instead of tea and I had a second pot but we were not charged for either of these...Didn't see much of the hotel but it looks very pleasant. All in all a very pleasant afternoon. Thank you",536,0.9934,0.356,0.0,0.644,positive
2015-10-30,2015-10,5.0,afternoon tea. We were given a voucher  for afternoon tea for two as a present from our son and daughter in law who had their wedding reception at the Hickstead so we chose to spend our voucher there and we wasn't disappointed. We brought some of the food home as we couldn't eat it all,286,0.3724,0.045,0.0,0.955,positive
2015-11-05,2015-11,5.0,"Overnight stay . We were a family with children so it is a very very good place to stay after a long day in Brighton .
The hotel is sooo clean and comfortable the staff are very friendly and helpful ............there is a little bar down stairs it is nice to have   Some beer ..........
Don't miss the break fast ( smoked salmon and fried eggs)",344,0.96,0.256,0.0,0.744,positive
2015-11-12,2015-11,4.0,"Visit to Brighton & Eastbourne.. We booked on a deal for two nights with a dinner included. On arrival we were told that there was a wedding at the hotel on the Saturday and were given a quiet room far from the main facilities. This was spacious, very quiet (apart from self closing room doors) with well lined curtains. We had an uninterrupted sleep on both nights 
Breakfast and dinner were excellent, especially the service, but the a la carte dinner is a bit expensive.
We used the hotel, which is only a short drive from Brighton, to visit there and then see friends in Eastbourne",585,0.7935,0.072,0.0,0.928,positive
2015-11-15,2015-11,4.0,"Very pleasant stay. Stayed here for four nights on a business trip. Hotel is comfortable and in a quiet location. The staff are extremely welcoming and service is excellent. They went out of their way to accommodate me and were friendly but not over familiar. 
The food was excellent. Really good choice of well cooked breakfasts - perfect poached eggs nice and runny yolks. Good choice of evening meal and exceedingly well cooked.
Perhaps could do with  a daily 'special' menus as I do not eat meat I would have welcomed more choice over four days. Otherwise excellent",569,0.9935,0.37,0.0,0.63,positive
2015-11-17,2015-11,4.0,Very comfortable stay. Stayed here for one night whilst attending a nearby function.  Had a lovely afternoon tea at the hotel.  Room was very nice and bed comfortable.  Buffet style breakfast was good with plenty of choice.  Plenty of car parking in nice grounds and very peaceful surroundings.  No complaints at all and would stay here again,342,0.9764,0.356,0.0,0.644,positive
2015-11-30,2015-11,4.0,"Nice quiet weekend away!. Booked two rooms (other was for brother and sister in law) on a package for bed, breakfast and evening meal.  Hotel reception was smooth and room was well appointed with few extra touches like slippers, fruit, water etc.  Cosy little bar for a few pre dinner drinks and a very good evening meal with plenty of choice and attentive waiting staff.  All in all well recommended",400,0.915,0.188,0.0,0.812,positive
2015-12-27,2015-12,3.0,"Wouldn't stay here again. Nearly all of the staff (cleaners and waiters) were very friendly and the breakfast was the best part of the stay, the full English was really good! The first thing we noticed was the overwhelming strong odour in the passage and room when we went up the stairs. The air smelled like an industrial strength cleaner or some kind of highly scented air spray, a very stale incredibly strong odour which permeated everything. (I really don't know what caused it) We could barely breathe so we slept with the window wide open as the whole room needed a serious airing. The room was a good size but was a bit run down overall, a loose tile on the bathroom floor in front of the sink, stains on the bed and carpet. Could do with general updating. There was NO hot water so it was like doing the ""ice bucket challenge"" in the shower in the morning. We would have accepted this at a small B&B but at a hotel we expected a hot shower for our money. The pillows were flat like pancakes, like resting your head on a bag of cement powder. Between the smell and the uncomfortable pillow, I had a splitting headache the next morning. When we mentioned the cold shower and pillow to the receptionist her manner and reply left us feeling slightly fobbed off. All anyone want's is a good night's rest, a good breakfast and a hot shower. We got 1 out of 3. We were relieved that we had only booked for 1 night",1415,0.9775,0.146,0.038,0.816,positive
2016-01-03,2016-01,5.0,"Wedding delight. My son and his fiancée settled on The Hickstead for a Christmas wedding. As it was between Christmas and New Year, we more or less had the place to ourselves.

A number of us stayed the night before the wedding and they provided an excellent buffet supper for about 30 guests.

Huge car park available - shouldn't be an issue if hotel is fully booked. No vending machines for late night snacks, but there is service station about 5 / 10 minutes walk away.

The rooms were comfortable ( we lucky enough to be on the ground floor very close to the reception) and spacious. Huge bathroom and large towels (often lacking!). Only down side for our room was that the laundry lorry came early one morning and parked outside our window. I notice the Sussex Search and Rescue team seemed to be based here as well.

Members of the party who had family rooms were given inter connecting rooms rather than cramming lots of beds into one room. Nice touch.

Free  WiFi available which didn't seem to suffer with loads of people logging on to the system.

Breakfast was buffet style and plenty of choice from continental style to full English. 

The wedding had been meticulously planned by our new daughter-in-law and overseen by Giles from the hotel. There never seemed anything that fazed him and the level of service from him and the staff was second to none. Full marks all round.

The wedding 'breakfast' (never understood that term) was first class and good alternative veggie and childrens' meals provided. Top notch DJ for the evening entertainment. Evening buffet provided for the guests and a huge pile of sandwiches provided for the late night revellers.

The two best men (we don't anything by half) needed a projector and screen for their speech and this was readily supplied and put in place when needed by the hotel team. The fab Giles again.

Breakfast the next day was again brilliant and no pressure to get us out of the rooms  by the correct time. The team were again helpful with regard to storing presents and dishing out wedding cake to the departing guests.

Cannot recommend strongly enough and will be returning in a few months when I seem to be acting as best man at another ceremony. 

I would say this is neither a budget hotel or luxury hotel but middle of the road, good old fashioned service from a caring and attentive staff. Did I mention Giles?

We had a slight hiccough when an elderly aunt fell over outside but again hotel staff helpful and caring. Thanks goodness for a couple of paramedics in the bridal party. 

(Sorry I can't provide any photos - they seem to be mostly wedding pictures)",2631,0.9987,0.199,0.015,0.787,positive
2016-01-17,2016-01,2.0,Overpriced and a bit dated. This hotel is slightly dated and the room is not that comfortable. I would say it is very overpriced for what you get. The room had the bare essentials but nothing more. The best part of it was the breakfast and the staff were very friendly. Will not be visiting again,296,-0.2435,0.074,0.104,0.822,negative
2016-01-19,2016-01,5.0,"Lovely Little Gem. I stayed here for the weekend with my boyfriend after we got a good deal on Groupon for a couple of nights. The grounds are really lovely, and there is plenty of free parking. The room was also nice, spacious, clean and the bed was really comfy. 

The restaurant was nice, a little pricey but the food was really tasty. There wasn't a lot to choose from but we were only there for 2 nights so it wasn't a problem.

The absolute best thing about the hotel was the staff. I didn't meet one person that wasn't friendly and helpful and and each person helped to make our stay a very pleasurable one",613,0.9637,0.205,0.046,0.749,positive
2016-01-25,2016-01,4.0,"Good food and excellent service. Enjoyed a Burn's Night supper here with a group of friends, and have been to the same event over several years.  The hotel atmosphere is very welcoming, the staff are charming and helpful, and the food was excellent.  I have never had a meal here other than the organised Burn's Night, but based on the standard of that, am sure their normal catering would also be very good",407,0.9661,0.28,0.0,0.72,positive
2016-01-26,2016-01,3.0,"Good function,room not so good. Location was great. Room a bit dark,need more lights.Radiator was behind heavy curtains which made it difficult to get changed in a warm room as no heat got into the room
Staff very good and help full",232,0.8089,0.265,0.136,0.599,positive
2016-02-10,2016-02,5.0,"A wonderful gathering of friends. We planned our club meeting of friends at this hotel for a number reasons, easy access to main through route (A23) and ample parking. But get inside, a great reception from the management and time to relax with a drink before lunch. We had planned a simple two course lunch which was impeccably served by staff, the quality of the food was excellent. A great place that we will use in the future",429,0.983,0.301,0.0,0.699,positive
2016-02-11,2016-02,4.0,"Yummy Cakes and Relaxing Afternoon Tea. The staff were very welcoming and friendly. We booked to have an afternoon tea at the Hotel and it was served in a quiet and relaxing room with comfortable chairs, great atmosphere for a nice tea. We were offered three choices of sandwiches salmon, egg mayonnaise and ham and mustard which my partner really enjoyed however I am not really a fish or egg fan but the ham was lovely. We were then offered a selection of home made cakes and a scone with jam and cream. All the cakes were absolutely delicious and their was a nice selection. We were  offered an endless supply of tea and coffee. We also chose to stay the night in the Hotel too. The room was very spacious, clean and met our expectations. The room was very comfortable to stay in for the night and breakfast was included in the price. The only thing I would say is that at breakfast time it was a little busy and some guests had to wait for the buffet to be replenished however it did not take long for the food to come out. The breakfast was your typical full English and the food was lovely but maybe a little bit more choice of hot food would be nice. There was also a cold breakfast option of cereal, fruit, yoghurts and pastries available. The pastry I did have was very yummy but again there was only two left for me to chose from. All in all our Hotel experience was very good and I would defiantly be recommending it to my friends and we will also be staying here again too",1484,0.9966,0.204,0.0,0.796,positive
2016-02-18,2016-02,4.0,in quite country. It was a nice quite hotel and a comfortable room. We stayed for valentines and was very disappointed with the event. No special decoration or acknowledgement in the dining room that it was a valentines special weekend. Not worth the money,256,0.3576,0.163,0.135,0.702,positive
2016-02-24,2016-02,4.0,"Business trip. Stayed here for just one night while on a business trip. when I stayed the hotel was just getting a little tired, still alright but just starting to show wear. The room was a ample size for one night and breakfast was quite nice. There was a conference being held and parking was a little tight",309,0.5725,0.088,0.029,0.883,positive
2016-03-02,2016-03,1.0,"Don't stay here if you want a good nights sleep. There is so much wrong with this hotel, that I’ll start with the good stuff as that’s the easy part.

The wifi is free and there is no onerous logging on or remembering passwords, it’s open and it’s free.
The room itself was clean and a good size
There is plenty of parking
The breakfast was nice.

Now here comes the bad…

The walls are extremely thin.  I was in room 112 which had the option to be an adjoining room to the room next door.  The door was obviously locked as this option was not taken.  The guests next door arrived back at gone midnight and I could hear every part of their conversation and every word on the television programme they were watching.  They were not being particularly loud, just having a normal conversation.  I was shocked and rather annoyed having been woken up.

There is insufficient lighting – 4 wall lights and that is it.  Fine for the evening wind down but I was trying to work having got back from my meeting earlier than expected and the light was fading, meaning I was struggling to see.

The mattress was rock hard, and I like a firm mattress but this was beyond firm and like sleeping on a plank of wood.  Several times I woke up in pain where my normal sleeping position was impossible due to how hard the mattress was.

The room was also incredibly hot, even though the radiator was off.  I overheated several times.  Opening the window was an option, however it is near a busy road which could be heard.

The bathroom was not as clean as I would have liked.  Small hairs were still present in the sink and the grouting was in need of a good scrub.  There was also mould on the ceiling above the shower.

When  I was checking out, the room had been prepaid but I had to tell the receptionist that who was trying to get me to pay.  She said ‘what makes you thin it was prepaid?’ as if I was trying it on.  I  had to forward my hotels.com booking details to her to prove it – after everything this was quite ridiculous.  I also wasn't asked if my stay was ok, meaning I couldn't provide this feedback to enable them to make improvements.

It was a business trip, and I didn’t get to choose the hotel but will be feeding back to avoid it in the future",2245,0.5906,0.077,0.064,0.859,positive
2016-03-22,2016-03,3.0,"Fair but with room for improvement. I tried the hickstead while in town for business more than once. Nice view all around, almost always cheerful staff.
One thing one has to consider is the level of noise when inside a room. The walls are so thin that anything that happens is going to get to your hears.
One other thing is internet speed. That is really annoying, most of the time even checking the mails gets difficult",420,0.7807,0.152,0.078,0.769,positive
2016-03-23,2016-03,5.0,"Best Value and Service. A beautiful location, just 15 mins outsidge Brighton (if you need to go there), with lovely walks and countryside. Staff and management work hard to see you right, and this is perhaps the best recommendation. Our room was really warm and spacious. We had a really quiet night, as they situtaed us away from a party which was taking place that night.   We had a DBB package for £99 - absolutely fantastic value for money. The meal was beautifully prepared and everything on the a la carte menu was included 3 courses, (steak - £5.50 supplement - thats all).  I had the Tuna which was cooked perefctly",623,0.9874,0.262,0.01,0.728,positive
2016-03-23,2016-03,4.0,"Don't knock it!. As an employee of HPC compressed air systems based in Burgess Hill, this hotel is always prebooked and ready to slip into after I've driven the 5 hrs  (after dealing with the southern drivers ) from the laid back West Country- Plymouth.
As a regular that has to forfeit his time on the road dealing with customers, my time spent here is what I need after a hard day in the classroom undertaking training. 
The staff are always welcoming, and for the morning breakfast stint, there is one member of staff who knows me by my first name...
For those who have given negative reports on this place, don't knock it. It's a 20 min drive to the nearest international airport; so close for those who need an overnight stopover to recharge their batteries, or those who just need to wind down after an intense absorption of air compressor components. 😉
",860,0.2244,0.043,0.031,0.925,positive
