date,year_month,rating,text,text_len,vader_compound,vader_pos,vader_neg,vader_neu,sentiment
2017-12-07,2017-12,4.0,"Great value stay. Second time we've stayed here on the classic lodges package. Good room and a free upgrade (fruit bowl, newspapers and slippers) as I have their privilege card, substantial afternoon tea with good pastries. Inclusive dinner was Pub style grub (fish and chips, burgers, steak etc) but deserts were beautifully presented. Breakfast buffet was adequate and there was a good choice of cooked options. Mine, smoked haddock and poached eggs was a mixed bag; fish very badly dried out but eggs were perfect and wouldn't be out of place on Masterchef professionals. All this said it was a good value package and we probably would use the hotel again",658,0.982,0.265,0.033,0.701,positive
2017-12-24,2017-12,5.0,"Afternoon tea. Visited for afternoon Christmas tea. Excellent with a good choice of sandwiches and cakes together with attentive service in elegant surroundings and lovely views. Great value, particularly as I also used my Yeo Valley Yeokens to get two for one",260,0.9638,0.357,0.0,0.643,positive
2017-12-31,2017-12,4.0,"Family Christmas gathering. I would like to thank all the very friendly helpful team working on the 28th Dec 2017. We really enjoyed spending our family Christmas with you all, many thanks for everything. Lovely welcome, hot dinner and excellent organisation from the hotel. Many thanks again and happy new year to all of you",325,0.9874,0.444,0.0,0.556,positive
2018-01-02,2018-01,5.0,"Pre-wedding stay. We stayed here prior to and just after a nephew's wedding in Brighton.

We cannot find fault in the manner in which the team run the business. The reception personnel were extremely helpful and courteous, providing us with a room which was not within earshot of a wedding function that night. The manner in which Kevin conducts proceedings at breakfast in the restaurant warrants special mention. The food was spot on, tasty and prepared to order.

We note that  a few negative comments have been left by folk. Hmmm... they are obviously welcome to share their views. However, if abject  luxury is what they are looking for, then for heaven's sake, search for luxury hotels in the first place, dig deeper in their pockets and pay luxury money.

For our family members, all was well. Thank you for looking after us",831,0.9452,0.145,0.032,0.823,positive
2018-01-02,2018-01,5.0,"Ammazing, relaxing and truely perfect.. First time here for new years eve, stayed here on three previous occasions.
What can we say about this Hotel. From the moment we got there till the time we left, the staff were were some of the best we ever had, nothing was to much trouble and considering the number of people staying that was a credit to the Manager and his team.
The food for New years eve was as always FIRST CLASS especially the number catered for.
We will be back during the year, also returning for New Year.
Thank you all for a very special night",560,0.9543,0.183,0.022,0.795,positive
2018-01-23,2018-01,4.0,"Birthday Party. Check in was easy and fast. Our room on first floor was large, clean and very comfortable. Free wi-Fi was easy to use in room, and flat screen TVs had good choice of stations. Tea and coffee provided with extra bonus of trouser press.comfortable beds to sleep in and bathroom had all usual extras, shower gel etc.
Attended a Birthday Party in the Function Room, which was large and spacious. Only downside was there was no dance floor, and we had to dance to the band on carpet. Bar was set up on a table which was not a problem and prices are reasonable for a hotel.

Breakfast was a highlight with a great selection of hot and cold food buffet style. Four choices of fruit juices and everything was fresh. Tea and coffee on request",749,0.9865,0.232,0.025,0.742,positive
2018-02-13,2018-02,3.0,"Needs updating. The staff were all very friendly but the bed mattress was really hard and uncomfortable and the bathroom was definitely in need of an update - both from a decorative and practical point of view.  The toilet took about an hour to refill so that it could be flushed again, and the handle looked and felt like it would break any minute.  Afternoon tea and breakfast were both good",393,0.7942,0.154,0.07,0.776,positive
2018-03-12,2018-03,3.0,"Afternoon Tea. The waitresses and reception staff were lovely. All except for the chef who you could hear constantly moaning in the kitchen "" they want it on brown bread!?! You said they wanted it on white!"" needless to say made us feel very uncomfortable.
 The highchair was filthy, waitress was happy to clean it and did apologise. Also the cup my daughter was given was dirty. The table cloth on the table looked clean, although napkins smelt of smoke.
Afternoon tea was nice enough, although you do get slices of cake rather than individual ones. Waitress was happy to fill up my tea pot. Also there was pop music playing, would have preferred something a little more relaxing, but that is just my opinion",709,0.8987,0.146,0.037,0.817,positive
2018-03-31,2018-03,4.0,"Brilliant wedding venue and top quality staff. From the moment we first viewed The Hickstead the staff were brilliant. Through the whole planning phases to the actual wedding day, the staff were friendly, helpful and accommodating. All the guests enjoyed the food and shared our views about the staff and venue. The numerous stresses of planning a wedding were definable made easier  with the help of Kellie and all the other staff members",439,0.9705,0.287,0.032,0.68,positive
2018-04-01,2018-04,4.0,"Lovely hotel in a quiet area but near to plenty!. We stayed here for a two night break, visiting Brighton and Arundel. The hotel was easy to find, had ample parking and was pleasant on approach. The hotel was clean and comfortable, staff friendly and our room spacious and more than adequate. Nice toiletries and plenty of tea and coffee available, as well as some biscuits!! Bed was comfortable and we had two good nights sleep. There was a wedding on the Friday night, although we didn't hear any noise from this and even this morning, the wedding party was kept separate from the other guests. Only grumble would be the, although speedy, English breakfast, which for our taste was rather undercooked (prefer a little colour on both bacon and sausage and tomatoes were not softened at all). Saying this, we would stay again. Have posted reviews on sea life centre, Brighton pavilion, cafe Rocco and the Brighton museum (Brighton appx 15min drive, reccomend the park n ride) and Arundel castle (appx 45 min drive)",1014,0.9933,0.217,0.0,0.783,positive
2018-04-08,2018-04,1.0,"Awful. I review hotels frequently and don’t like to give bad reviews but I am always very honest and unfortunately this hotel was pretty dreadful! I cannot believe the good reviews and ratings it has....they sound like a different hotel! When you arrive at the hotel it looks nice from the outside and is off the main road so in a quiet place. When we arrived there was a wedding ongoing. We checked in and found the lady on reception to be very unwelcoming and unfriendly. We thought she must have been busy or stressed but she was still like that later on. Our room was average, it was clean however the net at the window had rust staining along the bottom. The bathroom tiles had been broken and looked like they had just been put back on with blu tack! The rooms were not sound proof at all. In the morning we awoke to the sound of someone having a wee and breaking wind in the room above us!! We went out to nearby Burgess Hill for the evening and returned around 11pm. We ordered sandwiches from the 24hr menu to be told that that wasn’t actually 24hrs as there was no chef!! After complaining we were eventually given sandwiches. The one positive thing about the hotel was the lady serving at breakfast - she was very friendly and talkative. Unfortunately the breakfast itself wasn’t great and one of my friends was served a very under cooked poached egg! All in all we won’t be returning - we paid £137 for a night and I don’t think it was worth even half of that unfortunately",1485,0.9589,0.15,0.109,0.741,positive
2018-04-09,2018-04,3.0,"Rather unloved. Stayed March 2018, one night. £90 room only

When you first approach this property, you have this feeling that you're arriving somewhere really rather special. The entrance and driveway are almost grand and beautifully laid out and then you reach the front door to discover everything else is a bit of a let-down.

I'm going to overlook the fact that the hotel separately tried to overcharge me, first for the pre-paid room on arrival and then for dinner the next day. Perhaps these things happen and they did remedy the bill without fuss.

What surprises me is that the published photos do seem to be quite genuine and yet do so little to convey the tired state of this place. They claim the rooms are decorated in a contemporary style but the brochure must have been written c. 1975. And there seems to have been very little updating or maintenance since. Therefore, and especially given other local hotels in which I've stayed for quite a bit less (and including breakfast,) I thought the accommodation really poor value overall. Worn and dirty carpeting, mouldy shower seals and decaying furniture are just not acceptable.

Not wishing to be totally negative, it is certainly quiet which is a blessing and I did sleep well. I also can't fault the breakfast, that was a very pleasant surprise - plentiful and well-priced (on its own.)

If the price point were rather lower, I suppose I'd consider staying here again. But with so many more appealing and cheaper options locally, I doubt it",1507,-0.3466,0.114,0.112,0.774,negative
2018-05-03,2018-05,4.0,"A lovely setting and a warm welcome. . We were in the area as my wife was on a business course nearby.

The Hickstead was a good choice for a one night stay.

Set in a quiet rural area with plenty of free on site parking.

Spacious, well appointed room, which was Spotlessly clean. So a big thumb's up to the housekeeping staff for that.

Friendly staff at check in which was without delay.

We ordered evening meals from the room service menu and were very impressed with the food quality, quantity and the speed of service.  All faultless.

In the morning, breakfast was a relaxed affair with a buffet of hot cooked items and a range of juices and continental pastries, cereals etc.

Check out was set for 11am but as I wasn't feeling well I asked for a later checkout and 1 o'clock was agreed.  This was done with no extra charge, so a big thanks for that.

We will be back in the area in a few weeks time for another course for my wife and would not hesitate in choosing The Hickstead again.

The picture is an interior view of our room but the hotel does present itself well as you approach up the drive.

A good choice.  We'll be back",1140,0.9722,0.154,0.028,0.819,positive
2018-05-07,2018-05,3.0,"Lovely setting but in need of update. Firstly I have to say the hotel setting is lovely. Peacefully set  in the countryside with great surroundings. I don’t like to be negative but feel I have to comment. Firstly reception staff should be warm and welcoming. Didn’t feel this at all. 
The bathroom in our room smelt of urine , I went to mention it at reception but unfortunately another room wasn’t available , however we were offered a discount off our evening meal. I was surprised the lady in reception didn’t come to the room to smell for herself, it was as if she already knew!!
If you are vegetarian the menu for dinner only offers one dish. I’m afraid to say this tasted like a ready meal! The wine list could also do with updating. 
The staff at breakfast were lovely but appeared rather stressed. 
This hotel would be lovely if it were to be updated and customer care was a priority. The setting is fantastic. However I don’t feel enough is being done to maximise would could be a first class hotel",1007,0.9937,0.241,0.048,0.711,positive
2018-05-14,2018-05,2.0,"Sad demise of a ""Classic"".. We have stayed at the Hickstead two or three times a year for the last 5 years and have, unhappily, seen it go down and down.  It has never been top notch but it has so much potential that we just kept hoping that the owners would decide to invest in this property.  Clearly this isn't about to happen and it's unlikely we'll stay there again.

The hotel could be really lovely and to see the neglect is very sad.  The location is fabulous, the staff have always been excellent and very professional although, sadly, many have now left or are leaving.  The restaurant is, still, surprisingly good for an out of town 3* hotel.

However, the rooms!  They are in urgent need of renovation, especially the bathrooms where black mould is now the norm.  That said, they are clean, just very scruffy and unloved.

Yes, they apparently do a good trade in conferences etc. and this must be how they stay afloat but the hotel guests seem to be incidental and, allowing the bedrooms to become so run down, just shows disrespect for Classic Lodge's loyal clients, like us.

I'd love to read a glowing review this time next year to the effect that the place has been smartened up and looking great",1212,0.9922,0.227,0.091,0.683,positive
2018-05-23,2018-05,4.0,Worth a vist. Stayed at The Hickstead for 4nights last week and the staff were very helpful and friendly without being overbearing. The food at dinner and breakfast was very good . The afternoon tea which was part of the deal was very well presented and was very acceptable.We have stayed at several Classic Lodges hotels and found they all offer value for money,362,0.9376,0.221,0.0,0.779,positive
2018-06-23,2018-06,2.0,"A very disappointing experience. We have stayed before and personally I wasn't overly impressed then but it was passable, we booked again because it was convenient for what we wanted.

On this occasion we had a ground floor room but when I opened the curtains!!!! (I will attach a photo)   The room above us had creaky floorboard which meant I was awake at 7am - not too early but I was on holiday.  In the evening/night the walking around was at 1am.

I would have complained and ask to move but my husband wasn't bothered by it all and could sleep through floorboard issue.

We stayed 4 nights and during the whole time not one person asked us how the room was, or the food, nothing or I would have complained then (maybe they have learnt by experience not to ask)

I didn't recognise any of the staff from 9 months ago who were more pleasant and very helpful.

The atmosphere in the dining room for our evening meal was non existant and the service very slow, so we did not eat there again.

On the plus side the bed was comfortable",1035,0.9103,0.096,0.052,0.852,positive
2018-06-27,2018-06,3.0,"Mistake. We booked this at short notice as we needed to be in Brighton.
The lady who checked us in was very surly and we didn't feel very welcome. 
The room was OK. Dated but clean. The bed was a disappointment. Very uncomfortable.
NO AIR CONDITIONING. This was the biggest  problem as it was 30 degrees. We were given a small fan, but it too had seen better days and was very noisy. 
We went out for dinner and arrived back around 9pm. We walked through the front door towards Reception and a different lady was manning it. She never even glanced up and we didn't  the get the friendly 'good evening' which we have come to expect from the usual hotels we stay in. 
Sleeping was very difficult due to the heat and the bed.

Breakfast seemed rather chaotic. Tables were waiting to be cleared but the young girl who was serving  was run off her feet. 
The food was OK. Nothing stood out as warranting a mention. 
An elderly couple  came in who appeared to have been staying a week or so, and she demanded the restaurant supervisor sit down with her while she slated almost every meal she had eaten.  She was demanding a refund on her bill. 
At this point,  We were feeling very uncomfortable so got up and left. 
I'm afraid we wouldn't  return, though the hotel is In a  lovely  setting",1284,-0.8927,0.096,0.137,0.767,negative
2018-07-09,2018-07,5.0,"Quality and Convenience. My wife and I stayed at The Hickstead on a Saturday night - just B&B at the hotel, with family parties in Burgess Hill on Saturday night and Sunday lunchtime, to celebrate a landmark birthday for my brother.
For a 3 star hotel in its price bracket, we thought The Hickstead was excellent. The staff were helpful, friendly and efficient, breakfast on Sunday morning was fine, and our room was well furnished and fitted, and very comfortable.
We had asked for a quiet room, and the room we got on the ground floor at the back was very peaceful. And although there was a wedding reception in the hotel which included music and dancing in the evening, we heard absolutely nothing of it after we turned in.
I rarely enter a comment on Tripadvisor, but I confess that when I booked the hotel I was a bit concerned at a couple of other customers recent comments, and having been very happy with our stay I felt I should share our very positive experience!",973,0.9834,0.178,0.0,0.822,positive
2018-07-10,2018-07,4.0,"Great stop over. We stay here when we visit family in Brighton, as not a million miles, huge car park with plenty of space, rooms are nice clean and have every thing, breakfast great and staff very pleasant, Very quiet, and there is a bar if you wish to have a drink",266,0.9643,0.325,0.032,0.642,positive
2018-07-24,2018-07,3.0,Not bad. Food was nice and service was quick. Was left waiting at the bar for drinks a few times with nobody in sight. hotel room looked fine. The Bed was so uncomfortable quite possibly the worst night sleep I have ever had and the pillows were uncomfortable. Woke up with a bad back and the room was boiling. Friends who also stayed in another room had the same issues as us. Would not stay here again which is a shame as it is in a nice location and has good points but the bad points outweighs those,503,-0.7643,0.099,0.139,0.762,negative
2018-07-27,2018-07,3.0,"Could do better. we had afternoon tea at the Hickstead.  Sandwiches, champagne, scones and bite size desserts were all bought to the table at the same time.  After that we didnt see one single member of staff - no one came to see if all was well.  There was only one small tea plate each for both sandwiches and cake.  I didnt fancy putting scone or dessert on my plate which had mayonnaise and sandwich crumbs on it so took a plate from the neighbouring table.  There was no napkin.  The tea on offer was Tetley! no offer of any other more up market or speciality tea.  I would not go back and was glad that we had not paid for this delight - we had been given a voucher",671,0.8597,0.105,0.046,0.849,positive
2018-07-30,2018-07,3.0,Nice family do. Really friendly staff for our recent family party. They were helpful but unobtrusive. Hotel could really do with a spruce up and our bed mattress was old and tired. The pillows left quite a lot to be desired as well. Good location very near A23,260,0.8806,0.28,0.063,0.657,positive
2018-08-05,2018-08,4.0,"Special tea excursion. We were given their deluxe tea as a present. The tea, we had earl grey, was slightly unusual but very good
 
The selection of sandwiches, cakes and fancies were excellent. 

We had a really lovely time there. The staff were very friendly as well",268,0.9792,0.391,0.0,0.609,positive
2018-08-17,2018-08,4.0,"Afternoon Tea. My partner and I were given an afternoon tea as a present and thoughroly enjoyed our visit. There was a very good choice of sandwiches and they were fresh with good fillings, cakes and scones also very good. The restaurant was light and airy and the girls on duty were lovely and couldn't do enough for us - a very friendly greeting at reception always helps and we weren't disappointed. Many thanks",414,0.9794,0.316,0.025,0.659,positive
2018-08-21,2018-08,2.0,"Great location, service & food shame about the rest. I was given a Red Letter Day Tea for Two and thought this looked a great place. We arrived and thought it in a very lovely location, easy to park the car. Entering there was no one at reception, we walked around and found a dining room (looks as if it is in a time warp - as does the rest of the hotel we walked through - 70s shades of brown!!), the female member of staff could not have been more welcoming as she showed us to our table, for a hotel in such a great location it is a shame that all the windows of this room look onto the car park.

The tea was lovely, the sandwiches were made to our requirements (we were both impressed by this), everything was tasty and could not be faulted. Well done to the kitchen team for such a lovely tea. The room as said is very 70s and lacks any sort of atmosphere but, with such a sad view from the windows they would be hard put to give the place a good feel - I have ideas if they are interested.

When we left the lovely female staff member (the only member of staff we saw!!) was  on reception, she is a great asset and a credit to this establishment GIVE HER A PAY RISE this place needs her more than she needs it.

Location GREAT
Service GREAT
Food GREAT
Decor POOR
View POOR

This visit was saved by the service and food, thank you",1337,0.9948,0.226,0.077,0.697,positive
2018-08-26,2018-08,1.0,"So disappointed . Doors slamming constantly, room smells of damp, receptionist wasn’t available for 25mins which left us standing around waiting not knowing whats going on. Other guests are loud and staff don’t care. Upsetting and ruined our night",247,-0.7501,0.067,0.201,0.732,negative
2018-08-26,2018-08,5.0,"Highly recommend. A lovely venue for a wedding. Staff were all very helpful and friendly. The food was great and I am going to book an afternoon tea for my next visit as they look fantastic.
Special thanks to Andy, Imogen, Holly and Emily you were amazing",255,0.9842,0.445,0.0,0.555,positive
2018-08-27,2018-08,5.0,Would stay again. We visited for a wedding the room was good as a family room we had 2 interconnected rooms it was perfect. The food was fantastic and the staff couldn’t do enough to help at all given opportunities. We were very pleased with our stay,250,0.9565,0.313,0.0,0.687,positive
2018-08-28,2018-08,1.0,"Booked an afternoon tea with a voucher from Yeo Valley.. Booked an afternoon tea with a voucher from Yeo Valley. As per their menu, we chose 2 types of sandwiches each (Coronation Chicken, Roast Beef with Horseradish, Cheese with a Red Onion Chutney and Egg Mayo with Chives). We have also been served Fruit Scones, Mini Pear Tarts, Strawberry Cheesecake, Summer Berry Meringue and Sherry Trifle. Our initial reaction was OK, they were looking just OK. Once we started eating and we realised that something was not quite right therefore we have left most of the sandwiches and the Strawberry Cheesecake on the table. As the time was passing by our gut feeling was telling us to stop as something was not right. Luckily we did stop. As soon after we left their premises our stomachs were starting to react. We end up with very disturbed stomach problems for the whole afternoon and evening.  Do AVOID THIS PLACE FOR AFTERNOON TEA unless you want stomach problems",961,-0.9412,0.016,0.104,0.88,negative
2018-08-30,2018-08,3.0,"Could do better. Stayed for a couple of nights as friends were having their wedding here. Car park was very spacious and outside of hotel looked today. Booking in at reception was swift with pleasant staff. Bedroom was reasonably well equipped but looking a little tired. Carpet was stained and a bit worn. Bathroom wasn't too good with a terrible shower curtain, main mirror with bits missing and the bottom corner of the bathroom door rotted away. Shower was good pressure and temperature. Bed was comfortable but pillows were very uncomfortable. During the evenings in the bar area there was a distinct lack of staff and we had to go looking for someone nearly every time we wanted a drink. Very disappointed at cleanliness of bar area with noticeable amounts of dust on glass shelves and displays. 
Dining area was pleasant and food was generally of a good standard. Breakfast one day was cooked to order which I prefer and quality of produce used was very good. Wedding ran very smoothly with good food which was commented on by most guests. To round it up. Good and bad points. Need to spruce things up especially in bedrooms and hallways and pay a bit more attention to cleanliness and employ more staff (those staff that are there were very friendly and professional) An average 3 star",1293,0.7207,0.153,0.131,0.716,positive
2018-09-10,2018-09,5.0,"Comfortable, Clean and Freindly. Booked in to attend a friends wedding,  stayed a few nights longer.  The rooms was comfortable and clean,  staff were very friendly and attentive.   A little noise from ongoing events and people moving about on the floor above/ door slamming but no more than you would get living in a family home or flat! All in all an extremely pleasant stay!",377,0.9181,0.229,0.036,0.735,positive
