date,year_month,rating,text,text_len,vader_compound,vader_pos,vader_neg,vader_neu,sentiment
2013-06-09,2013-06,5.0,"An amazing venue and excellent wedding venue. Thank you!. I just want to say on behalf of myself and my new husband how over the moon we were with the hotel and the service we received for our wedding on the 1st June.

Right from the start we were made to feel very welcome by Giles, Dawn and Hannah and the other members of the Hickstead team. Nothing was too much trouble and everything from the food to accommodation was out of this world.

The finishing touches such as the engraved cake knife were simply lovely and it meant so much to us that you went to the trouble of providing us with that lovely keepsake.

There simply are not enough words to explain what a fantastic job you all did and we will remember it always. The room looked lovely and there simply is nothing we could fault at all.

Thank you so much and we will definitely be recommending you to friends and family and will be coming back very soon to enjoy more wonderful food and company.

Thank you all again for all your hard work especially to Hannah who was our wedding planner at the Hickstead and went above and beyond to fulfil our dreams.

We look forward to seeing you soon",1154,0.9929,0.208,0.027,0.766,positive
2013-06-25,2013-06,4.0,"Comfortable and mostly good. A fairly basic hotel in terms of facilities, but what it does is mainly done well.  The setting - rural but handy for the A23 - is good (apart from the adjacent industrial estate, the grottier part of which forms the view from some rooms).  The service is mostly good, especially in the restaurant,  (though little interest was shown in the issue I raised about TV reception in my room - no BBC channels were available).  The room was spacious, comfortable and clean.  My overall rating reflects the value for money given the price I paid",567,0.9784,0.239,0.023,0.738,positive
2013-06-26,2013-06,4.0,"Afternoon tea. I bought afternoon tea for my friend through buyagift. The food was lovely. The service a wee bit slow, well we didn't really see anyone that much! We expected the hotel to be surrounded by lovely grounds as we wanted a walk after being so stuffed! But there was nothing on site, we had to leave the grounds and 5 mins up the road was the main road so not great to walk! But the food was very nice (so much!) so thats the main thing really",454,0.7649,0.135,0.06,0.805,positive
2013-07-02,2013-07,4.0,"Great Peaceful Location & Friendly Efficient Staff. With Brighton Hotels fully booked, I chose the Hickstead House Hotel.  It is just 20 minutes from Brighton on the A23 and very easy to find with clear 'brown' hotel signposts to guide you in.
Lauren on reception was charming and very helpful - when I booked I was told there was a large wedding party on the Saturday evening but with rooms almost fully booked I thought it was worth the risk. She again showed concern on booking in that we knew about the wedding party and advised that the fire doors would exclude any sound. 
 I need not have worried.  The disco was loud but the fire doors completely blanked out any noise and the wedding guests were careful not to disturb other hotel guests - thank you.
Our rooms (123 and 220) were spacious, very clean and peaceful, and the ensuite bathroom had an excellent powerful shower.  It is a 3-star hotel and so that is what you get although this hotel is better than any other 3-star in Brighton and far better value.
Despite the wedding party filling the bar, we were able to order late at night 22:50 some very tasty sandwiches - I had smoke salmon which was really generously filled and the egg mayonnaise was also very abundant and all came with some very well cooked chips and fresh salad.  The delightful waitress was only too pleased to serve us so late and despite being there beyond her going home time seemed genuinely pleased to help us.
Perhaps the highlight was the breakfast; the restaurant manager coped brilliantly (constantly surveying the diners to ensure our needs were met - unusual in my experience, so very well done -  and despite the packed room the service was quick and efficient. Coffee and toast appeared very promptly and I noticed that the buffet food was topped up regularly - they don't put too much out at a time in order to have it kept piping hot.  The sausages were good quality and well cooked, the back bacon was also well cooked (I hate undercooked bacon), there were fresh grilled tomoatoes, loads of mushrooms, black pudding and hot baked beans, and we ordered poached eggs which were perfectly cooked too; the scrambled egg on the buffet didn't look too inviting. There were fresh warm croissants, a choice of juices, yoghurts and fresh fruit.  The bowls of jams and marmalades looked homemade although I doubt they were and there was the largest pot of Marmite I have ever seen - well done the chefs and restaurants staff.
This was a really great value hotel in a lovely rural location with a huge car park.  The staff were always smiling and attentive - you can't ask for more than that.  We will be going back.  You will need a car or a £25 taxi ride into Brighton",2710,0.9991,0.254,0.041,0.705,positive
2013-07-09,2013-07,5.0,"Fabulous Find. I have just been here for 2 nights for my best friends wedding. The staff were amazing and so helpful. It wasn't the setting that I thought but once it was all dressed for the wedding it looked amazing. 

The bedrooms where lovely and very clean with a fabulous bathroom. We all had free wifi as well. 

The breakfast was really good as well. Nice and close to Brighton also which was very handy and only a 15 min taxi ride to the train station. I will stay here again next time that I visit Brighton as it is cheaper but still close enough to get there cheaply on the train",589,0.9937,0.328,0.0,0.672,positive
2013-07-13,2013-07,4.0,"A good out of Brighton base. A group of 4 couples stayed here as we were heading to Brighton for a night out. We got a large taxi which cost £40 so the savings on the hotel were significant than staying in Brighton, also you could stay just the one night, which seems to be an issue in Brighton for most hotels.
When we arrived the weather was beautiful so we sat outside and enjoyed the weather. The barman came to the table twice offering to get our refills, so we didn't have to go to the bar! Nice touch. In the gardens there were tables and chairs as well as deckchairs and the garden was  a sun trap.
The room was spacious and we had a large double and single bed in our room. 
The bathroom was well proportioned and the shower was reasonably powerful.
Tea/Coffee and biscuits were in the room too
The bed was comfortable, which is the main thing! So a good nights sleep was had.
There didn't appear to be any temperature control, so the room was warm early evening when we were trying to get ready.
Breakfast was good, even though it was a buffet.
I would definitely stay again, as an alternative to the expensive Brighton hotels",1136,0.9866,0.161,0.01,0.829,positive
2013-07-13,2013-07,4.0,"Lovely afternoon tea. My grandson bought me here for afternoon tea today and it was a really pleasant experience. The staff were welcoming and helpful. The food was delicious and plentiful.The atmosphere enjoyable and the tables spaced well for privacy. The only reason it lost a star from me was the lack of service. Once served with tea ,sandwiches and a selection of scones and cakes we were left alone which was fine for the most part,but an offer of more tea would have been nice. We did catch a staff member eventually to replenish the pot of tea ,and to be fair ,when asked the tea came promptly,but it would have been a nice touch have had it offered. This is a small point and we did enjoy our tea and would recommend it to friends. Good value",752,0.9891,0.265,0.038,0.697,positive
2013-07-14,2013-07,5.0,Our special day made more special!!!. We had our wedding on 1st December 2012 and it was the best day ever! Not just the event but the work the hotel did to make it all a special day!! We couldn't praise the staff enough for their efforts. Nothing was ever too much trouble for anybody. The food was amazing rooms were amazing and my dancing was dodgy!!!! We both loved it that much we will be booking in again when it's our 1st anniversary :-),444,0.9686,0.263,0.086,0.651,positive
2013-07-19,2013-07,4.0,"Summer break. We stayed three night on the all inclusive package, the weather was very hot, but we were provided with a fan which really helped us to sleep.  On the whole the restaurant food was good although if you stayed more than three nights you might struggle with the variety on offer.  The food was well presented, apart from the over cooked garlic bread and the breakfast bacon was dry and over cooked, the continental breakfast had a selection of fruit and cereal with natural yoghurt, flavoured yoghurt and a selection of juice. We would also recommend the cream tea especially if you can enjoy it outside under the umbrella. A little bit of extra attention to minor maintenance issues (bathroom fan not working) would make things even better.  This being said we would stay again when we next visit the area",818,0.9753,0.165,0.018,0.817,positive
2013-07-22,2013-07,3.0,"Good - but could be better. We have now stayed there twice when visiting relatives in the area. Rooms are comfortable and well-appointed, and the breakfast was an improvement over our previous stay. The property is beginning to look a little frayed around the edges, but the staff are cheery and helpful.Just didn't seem to represent good value for the price we paid",366,0.9801,0.318,0.0,0.682,positive
2013-07-27,2013-07,4.0,"Clean, comfortable and pleasant staff.. I stayed for two nights on business. The hotel was not my choice but I found it to be clean, comfortable and friendly.  It is a bit of stuck in the middle of nowhere, well if like I was having travelled by train and working in Haywards Heath.  The staff were very friendly from the reception staff, barman and the restaurant waiters.  The choice was fairly limited if staying for a while, however the food I had on the two nights was excellent. 10 ounce pork chop on mustard mash with a thick ju, gravy. Very nice. There were also a special meal choice on each night. I was served promptly and politely. I enjoyed the restaurant experience even on my own.  The place was quite busy but the standards were maintained.  The breakfast offered a good choice of continental and English  style, again prompt service as there were plenty of guests wanting to get away to work. The only criticism would be that there is no air conditioning in the bedrooms and it was very warm at night.  However there was good wifi freely available",1064,0.9914,0.227,0.068,0.705,positive
2013-07-28,2013-07,3.0,"Wot- no aircon!. This is a modern hotel in an attractive setting. It has been created by adding an extension to an older property and the mix blends very well. The rooms are large and equipped with table. chairs and the usual TV and hostess tray. However there is no air conditioning and the windows are not large. As a result the room was stifling and even the fan, produced on request did little to improve matters.  Despite the comfortable bed a good nights sleep was difficult.There appears to be air conditioning in the restaurant, so why not else where? The bathroom was spotless with good quality towels and toiletries.
We received a warm welcome at reception and the restaurant service was good, as was the buffet breakfast. However I felt the B& B rate was expensive",775,0.9505,0.166,0.053,0.782,positive
2013-08-03,2013-08,4.0,Fab staff and good food. We stayed at The Hickstead Hotel for one night whilst working at the Hickstead Showground. We found the staff very helpful and polite. The food was very good and the room comfortable. The price of the overall stay was very reasonable and we well definitely stay here again when we are down that end of the country,338,0.96,0.269,0.0,0.731,positive
2013-08-10,2013-08,4.0,"Tea for Two. We were given a voucher as a gift - 'Luxury Tea forTwo'. The Hickstead Hotel is an attractive red brick building set in pleasant grounds. The staff were polite and attentive, The room was airy and comfortable with a view of the garden. Tea ( or coffee ) arrived promptly, shortly followed by a generous quantity of finger sandwiches,cakes and scones.Nicely presented,no complaints at all - very civilised - very English!",433,0.923,0.184,0.031,0.784,positive
2013-08-22,2013-08,5.0,"LOVELY AFTERNOON. Have just enjoyed an afternoon tea for two at this beautiful hotel. On arrival was greeted with a smile and shown to our table.  Tea was served and a plate of sandwiches and a nice cake stand with chocolate ecclairs, scones with cream and jam , strawberry meringue and lemon drizzle cake. We were told to take our time and enjoy the tea. Not rushed and a good atmosphere. Must say enjoyed it very much, but did come away with full stomachs. Would recommened highly",482,0.934,0.197,0.0,0.803,positive
2013-08-22,2013-08,4.0,"Nice but not special. A gift for my parents.  We were well treated - the food was good but having experienced several other 'afternoon teas' this one lacked that extra something that makes it an occasion.
There was a good selection of sandwiches and cakes - warm scones (whipped cream not clotted but you can't have everything) - but no tea menu - we were offerred tea or coffee although when asked they found some fruit tea.  There may have been a vast selection of teas it was just not offerred.  The food and drinks were presented and then left with no follow up.  
The extra ooomph was missing",597,0.0526,0.13,0.112,0.758,positive
2013-08-24,2013-08,5.0,"very comfortable hotel. We have stayed here a few times now.  The staff are welcoming and efficient, the rooms are a good size and have good TV and tea making facilities.  The breakfast is excellent.  It is quiet.
It is in a very good position to explore Sussex and fairly close to Gatwick airport.
The whole experience is very pleasant",336,0.9766,0.33,0.0,0.67,positive
2013-08-31,2013-08,5.0,"Afternoon tea for two. The Hickstead is one of the growing ranks of hotels offering special afternoon tea.
This was delightful. Greeted by attentive, friendly staff and shown to a choice of table in the lounge.

Wonderful views of the Sussex countryside. Excellent spead including sandwiches, scones, jam and cream and fresh cream cakes and as much tea as you want.

Will go again.  FIRST CLASS",394,0.9702,0.301,0.0,0.699,positive
2013-09-01,2013-09,3.0,"Pleasant but nothing special. A one night stay recently (with a special offer) when visiting family nearby. Wonderful setting and very tidy appearance of the hotel. Inside seemed a little dated and the room was clean and tidy but again lacked the finishing touches. 
Breakfast was hearty in the morning, but served in a restaurant that was too hot... there were no windows open and service that was delivered like it was a theatre performance to a large crowd! Loud and overstated!",481,0.9253,0.184,0.058,0.759,positive
2013-09-05,2013-09,3.0,"Nice - but could do better. We recently stayed for 1 night as we were visiting relatives near-by. We had a family room for 2 adults and 1 child.

As other have mentioned, the hotel needs an update in certain areas, with paint/plaster peeling and very old carpets.

Our room was adaquate but everything had been set up for 2 people not 3. upon asking for the extras, they were sorted quickly and politely by the staff. The extractor fan wasn't working in the toilet and the toilet didn't seem to flush correctly, which left it dripping constantly all night. The room was hot and a wlarger window that opened fuly would have been better.

The breakfast was a very good range but the cooked parts were overcooked in parts.

The staff were very friendly and most helpful at all times.

I would stay here again - but subject to cost, as it is a little too much for what you get",872,0.9824,0.156,0.0,0.844,positive
2013-09-19,2013-09,5.0,"Wedding. From the moment of looking for a venue to too accommodate out entire wedding package the service was of excellent standard. Giles the manager was extremely professional throughout and on the ball at all times.
The wedding itself was perfect and everyone commented on how perfect it was from venue to food to everything.
Jenny and Hannah and Laura and Lauren were all exceptional.
Would highly recommend for a day to remember",433,0.9344,0.17,0.0,0.83,positive
2013-09-22,2013-09,2.0,"Not as advertised!. My wife and I booked a night in this hotel because one of our children had given us a Virgin Experience ""Dining Treat for Two"" voucher as a gift. From the list provided this hotel was nearest to our home and in the ""blurb"" it promised, ""an intimate dining experience"" and the experience of, ""simply relax for an evening of pure indulgence"". So...we expected a well cooked and professionally presented meal. We  hoped for perhaps even a gourmet meal- well  you would wouldn't you?
WRONG! First of all I must say that the staff were friendly and helpful throughout but that's as far as it went. Our table was graced with one sad and dusty silk flower with the cheapest paper napkins. There was a side plate with knife - never used because no bread was forthcoming in any shape or form. The meal itself was best described as an average to poor pub meal. 90% of the food was the commercial pre-prepared kind. My wife's meal was sent back since it was a dried up overcooked disaster.
Our room was big and clean, the bathroom had tiles lifting and a ventilation fan that never switched off - keeping my wife awake all night. At breakfast my wife's poached egg was a solid yolk surrounded by grey scum and...oh yes they forgot the bacon! The coffee was absolutely tasteless and my wife's tea left a great deal to the imagination. What a pity. Ok if you are a tired commercial traveller just wanting a nights stopover but certainly a great disappointment to us",1472,0.9847,0.196,0.077,0.727,positive
2013-09-24,2013-09,4.0,"One night. We went for one night as we'd been invited to a friends wedding, the reception being held in the hotel.
Reasonably priced hotel. The service was excellent from the receptionists to bar and waiting staff. The wedding celebration was a hoot, dancing and people chatting loudly. However when in our room, very near to the disco area, there was little or no noise, the fire doors suppressed all noise, and more to the point they shut quietly. No banging of corridor doors in the small hours, unlike so many other hotels we've stayed in. What a treat.
The room was newly refurbished, clean and well appointed. We asked for more tea etc (English tea drinkers !!) and it was all was delivered in 5 minutes. This in a hotel with some 150 wedding guests and hotel residents. Impressive. Definitely recommend this place as a quiet stopover while exploring Sussex",863,0.9506,0.138,0.038,0.824,positive
2013-09-26,2013-09,4.0,"Very comfortable. We stayed at the hotel following a wedding held there. Check in was smooth, the room was comfortable, the bathroom clean and well equipped. The room was a good temperature and a good size. Plenty of hanging space. Staff very efficient and helpful. Breakfast was very good with a really nice buffet. Would definitely stay again",344,0.9844,0.41,0.0,0.59,positive
2013-10-08,2013-10,4.0,"Virgin Experience voucher. Stayed 1 night on a Virgin voucher for bed breakfast and evening meal. Unlike other reviewers I was not expecting gourmet food or 5 star service, but I was very impressed with what we had. Yes the napkins were paper and there was no bread offered, but with a 3 course dinner I didn't need bread. 
The hotel was clean and well presented, with chocolates, water , robes and slippers in the room. The bathroom is a little dated with a shower curtain that attacks you as you shower, but it was clean and everything worked. 
We did have some problems with the heating, with nothing during the evening but it came on full blast during the night. I think this could be a changing season thing.
The staff were professional and pleasant. I thought the food was well presented and very tasty. The menu wasn't extensive, but there was enough choice. The waiting staff were attentive without being too fussy, ( there were only 5 tables occupied). 
Breakfast was a buffet with plenty of choice of hot food or cereals, croissants etc.
The location is good, 3 minutes off the A23, but no noise",1105,0.9504,0.127,0.057,0.816,positive
2013-10-18,2013-10,3.0,"Not the best value for money. We stayed one night while visiting friends nearby; we arrived in the middle of a wedding reception but our room was on the other side of the hotel and we couldn't hear the main party. All was good until some of the wedding guets decided to continue partying in the room beneath ours at 1.30. There was music blaring, loud drunken voices and lots of door banging. We called the night porter and by 2.30 they had quietened down enough for us to eventually get back to sleep. Obviously the hotel can't help having antisocial guests but not getting a good night's sleep puts us off having more weekends away. 
Seeing that another reviewer had a bathroom where the ventilation fan wouldn't switch off, we had one that wouldn't switch on.
On the plus side, the room was dark - no green or red LEDS glowing from smoke alarms or aircon machines, no minibar fridge to hum, no traffic noise, a fairly comfortable bed, spacious room and very friendly staff. 
We didn't get up for breakfast as we decided to sleep in after the bad night, so can't comment on the food",1084,0.3594,0.107,0.11,0.783,positive
2013-10-20,2013-10,5.0,"Friendly service and a good location. We needed somewhere in this area for a couple of nights and this hotel is close to a junction on the A23 giving good access north and south. We took the 'Autumn Break' deal. This gave full B&B plus an evening meal with fizz and canapés beforehand. Everyone was helpful and friendly. The room on the first floor was a good size with two comfortable chairs and a table as well as a desk and dressing table area. We would be happy to go back here.

All the food was great too!",511,0.9859,0.28,0.0,0.72,positive
2013-11-01,2013-11,4.0,"Yummy afternoon tea. A friend and I enjoyed a delicious afternoon tea of sandwiches and cake, which I was given as a gift. There was more than we could eat but you even get a doggy bag with the leftovers! As much tea or coffee as you want too. A lovely treat. The service was friendly and efficient and we were able to take our time and have a god chat. I would recommend this as an indulgent treat or as a gift",411,0.9902,0.375,0.0,0.625,positive
2013-11-05,2013-11,1.0,"buissiness trip. BE WARNED!!!!!!!!!!!!!! Do not stay in room 117 or 118. The interconnecting door has an old fashioned key hole with no key placed in it.....The concern here is that you can be seen by the occupant/s in the adjoining room. I was able to see a gentleman standing in his room using his mobile phone. My concern here was that if I could see him....then he could obviously see me! I complained and was moved to another room. I was also offered 5 pounds off my bill for my trouble.The manager, Mr Paul, informed me that in a six year period (since the rooms were revamped) they have never recieced any complaints of this nature...... (very concerning) as this poses the question why not? I demanded that these rooms were taking off sale until this issue had been addressed. Mr Paul confirmed that they would not sell the rooms (other than to families) and that work would commence immediately (I am not sure I believe this statement especially as according to Mr Paul he had recieved no previous complaints). Mr Paul and his team have a duty of care to protect and maintain their guests privacy and well being. Im my opinion they have totally failed to do so. This was my second visit to the hotel but after this incident I will never stay at this hotel again and I strongly recommend that before you do that you seek confirmation that this issue has been addressed. I feel my privacy has been totally violated. Also the bill was paid in full as I felt that Mr Paul and his team believed that I was only complaining because I was looking for a discount!!!! talk about add insult to injury",1599,-0.9378,0.047,0.086,0.867,negative
